{
  "$schema": "https://axm.sh/schemas/knowledge.schema.json",
  "owner": "@craigsmitham",
  "name": "field-notes",
  "version": "1.0.0",
  "type": "knowledge",
  "format": {
    "name": "okf",
    "version": "0.2"
  },
  "bundleRoot": "src",
  "description": "Operational field-note practice for preserving factual session friction, observed cost or impact, outcomes, and safe evidence for later analysis",
  "keywords": [
    "field-notes",
    "observation",
    "continuous-improvement",
    "friction",
    "developer-experience",
    "session-friction",
    "evidence",
    "resilience-engineering"
  ],
  "license": "CC-BY-SA-4.0",
  "homepage": "https://github.com/craigsmitham/agent-extensions",
  "recommendedPacks": [
    "@craigsmitham/packs/field-notes"
  ],
  "standalone": false,
  "repository": {
    "type": "git",
    "url": "https://github.com/craigsmitham/agent-extensions",
    "directory": "knowledge/field-notes"
  }
}
