{
  "$schema": "https://axm.sh/schemas/knowledge.schema.json",
  "owner": "@craigsmitham",
  "name": "software-engineering",
  "version": "2.0.0",
  "type": "knowledge",
  "format": {
    "name": "okf",
    "version": "0.2"
  },
  "bundleRoot": "src",
  "description": "Portable engineering craft for a repository's execution surface: task graphs, script surfaces, caching intent, and invocation contracts for humans, agents, and CI",
  "keywords": [
    "software-engineering",
    "command-execution",
    "task-runner",
    "task-graph",
    "package-scripts",
    "npm-scripts",
    "wrapper-scripts",
    "build-cache",
    "monorepo",
    "developer-experience",
    "agent-harness",
    "ci"
  ],
  "license": "CC-BY-SA-4.0",
  "homepage": "https://github.com/craigsmitham/agent-extensions",
  "standalone": true,
  "repository": {
    "type": "git",
    "url": "https://github.com/craigsmitham/agent-extensions",
    "directory": "knowledge/software-engineering"
  }
}
